{
        "id": "{data_partition_id}:work-product-component--ConstantVolumeDepletionTest:{record_id}",
        "kind": "{custom_schema_authority}:wks:work-product-component--ConstantVolumeDepletionTest:{schema_version}",
        "acl": {
            "owners": ["{acl_viewers}"],
            "viewers": ["{acl_owners}"]
        },
        "legal": {
            "legaltags": ["{legal_tag}"],
            "otherRelevantDataCountries": [
                "US"
            ],
            "status": "compliant"
        },
        "tags": {
            "tag1": "Report for PVT",
            "tag2": "Report for PVT"
        },
        "meta": [],
        "data": {
            "Datasets": [
                "{data_partition_id}:dataset--File.Generic:dataset_test:"
            ],
            "PVTReportID":"{pvt_record_id}:",
            "FluidSampleID": "{data_partition_id}:master-data--FluidSample:fluid_sample_test:",
            "AnalysisDate": "2023-03-23",
            "LabSampleIdentifier": "20207905-20",
            "LaboratoryName": "Lab",
            "Remarks": [
                {
                    "Remark": "Mounted",
                    "RemarkID": "Remark 1",
                    "RemarkSource": "RemarkSource"
                }
            ],
            "DDMSDatasets": []
        }
}
