{
    "id": "{data_partition_id}:work-product-component--SamplesAnalysis:{record_id}",
    "kind": "{custom_schema_authority}:wks:work-product-component--SamplesAnalysis:{schema_version}",
    "acl": {
        "viewers": ["{acl_viewers}"],
        "owners": ["{acl_owners}"]
    },
    "legal": {
        "legaltags": ["{legal_tag}"],
        "otherRelevantDataCountries": [
            "US"
        ],
        "status": "compliant"
    },
    "tags": {
        "NameOfKey": "String value"
    },
    "meta": [],
    "data": {
        "SampleIDs": [
            "{data_partition_id}:master-data--Sample:dd76cf6c-226f-5636-ad1b-1ca0f8249cc10"
        ],
        "ReportSampleIdentifiers": [
            "45H"
        ],
        "AnalysisDate": "2022-12-16",
        "DepthShiftsID": "{data_partition_id}:work-product-component--WellLog:Test:",
        "LaboratoryIDs": [
            "Lab 1"
        ],
        "LaboratoryNames": [
            "Corelab",
            "Weatherford Labs"
        ],
        "Remarks": [
            "Temperature 68F",
            "Second Remark",
            "Third Remark"
        ],
        "DatePublished": "2022-12-16T11:46:20.163Z",
        "ParentSamplesAnalysesReports": [
            "{sar_record_id}:"
        ],
        "RockSampleAnalysis": {
                "RockSampleAnalysisFamilyID": "{data_partition_id}:reference-data--SampleAnalysisFamily:Geochemistry",
                "RockSampleAnalysisMethodID": "{data_partition_id}:reference-data--SampleAnalysisMethod:TBD",
                "RockSampleAnalysisMeasurementID": "{data_partition_id}:reference-data--SampleAnalysisMeasurement:TBD",
                "SamplesAnalysisTypeIDs": [
                    "{data_partition_id}:reference-data--SampleAnalysisType:Geochemistry.OtherMethods"
                ]
            },
            "SamplesAnalysisCategoryTagIDs": [
                "GeoChem",
                "PhysicalChemistry"
            ],
            "AvailableSampleAnalysisProperties": [
                "ApiGravity",
                "ApiQualifier",
                "ApiRemark",
                "VolatileContentOfOil",
                "PourPoint",
                "PourPointQualifier",
                "WaxContentPct",
                "WaxContentQualifier",
                "WaterContentPct",
                "WaterContentQualifier",
                "SulphurContentPct",
                "SulphurContentQualifier",
                "NickelContentPpm",
                "NickelContentQualifier",
                "VanadiumContentPpm",
                "VanadiumContentQualifier",
                "CloudPointMethod",
                "CloudPoint",
                "CloudPointUnits",
                "PourPointMethod",
                "PourPointUnits",
                "MeltingPointMethod",
                "MeltingPoint",
                "MeltingPointUnits",
                "GasOilRatio",
                "ReservoirTemperature",
                "UniqueID",
                "IronContentPpm",
                "SodiumContentPpm",
                "NickelVanadiumRatio",
                "AsphalteneContentPct",
                "SpecificGravityQualifier",
                "SpecificGravityOfUnspecifiedOrigin",
                "TotalAcidNumber",
                "MethodOfAnalysisForSpecificGravity",
                "MethodOfAnalysisForViscosity",
                "MethodOfAnalysisForSulphurContent",
                "MethodOfAnalysisForNitrogenConcentration",
                "NitrogenConcentration",
                "CarbonConcentration",
                "HydrogenConcentration",
                "OxygenConcentration",
                "NickelVanadiumRatioPercentage",
                "VanadiumNickelRatio",
                "VanadiumNickelRatioPercentage",
                "Viscosity",
                "TemperatureOfViscosityMeasurement",
                "SilverConcentrationPpm",
                "AluminiumConcentrationPpm",
                "BoronConcentrationPpm",
                "BariumConcentrationPpm",
                "CalciumConcentrationPpm",
                "CadmiumConcentrationPpm",
                "ChromiumConcentrationPpm",
                "CopperConcentrationPpm",
                "PotassiumConcentrationPpm",
                "LithiumConcentrationPpm",
                "MagnesiumConcentrationPpm",
                "ManganeseConcentrationPpm",
                "MolybdenumConcentrationPpm",
                "PhosphorusConcentrationPpm",
                "LeadConcentrationPpm",
                "SiliconConcentrationPpm",
                "TinConcentrationPpm",
                "TitaniumConcentrationPpm",
                "ZincConcentrationPpm",
                "MeasuredAverageMolarWeight",
                "MeasuredDensityAt60F",
                "PercentOfMudContamination",
                "SampleDensityAt60DegreesCelsius",
                "SampleDensityAt15DegreesCelsius",
                "MolecularWeight",
                "WaterSediment",
                "MercaptanSulphurConcentrationPpm",
                "NitrogenQualifier",
                "BasicNitrogenConcentrationPpm",
                "ColourStabilityFlag",
                "PenetrationPoint",
                "SofteningPointQualifier",
                "SofteningPoint",
                "SmokePoint",
                "FreezePointQualifier",
                "FreezePoint",
                "CetaneIndex",
                "RefractiveIndexAt70DegreesCelsius",
                "DieselFuelRating",
                "AnilineLubricantMiscibility",
                "ChromiumQualifier",
                "CopperQualifier",
                "ManganeseQualifier",
                "SodiumQualifier",
                "MolybdenumQualifier",
                "LeadQualifier",
                "IronQualifier",
                "CalciumQualifier",
                "ZincQualifier",
                "TotalMercury",
                "FilteredMercuryConcentration",
                "SaltConcentration"
            ],
        "Datasets": []
    }
}
