{
      "id": "{data_partition_id}:work-product-component--DifferentialLiberationTest:Autotest_DF_Test",
      "kind": "{custom_schema_authority}:wks:work-product-component--DifferentialLiberationTest:1.0.0",
      "acl": {
          "viewers": [
              "{acl_viewers}"
          ],
          "owners": [
              "{acl_owners}"
          ]
      },
      "legal": {
          "legaltags": [
              "{legal_tag}"
          ],
          "otherRelevantDataCountries": [
              "US"
          ],
          "status": "compliant"
      },
      "data": {
          "PVTReportID": "{data_partition_id}:work-product-component--PVT:stable:",
          "FluidSampleID": "{data_partition_id}:master-data--FluidSample:fluid_sample_test:",
          "AnalysisDate": "2012-12-15",
          "LabSampleIdentifier": "20207905-20",
          "LaboratoryName": "CoreLab",
          "DDMSDatasets": []
      }
}
