{
        "id": "{data_partition_id}:work-product-component--SwellingTest:{record_id}",
        "kind": "{custom_schema_authority}:wks:work-product-component--SwellingTest:{schema_version}",
        "acl": {
            "viewers": ["{acl_viewers}"],
            "owners": ["{acl_owners}"]
        },
        "legal": {
            "legaltags": ["{legal_tag}"],
            "otherRelevantDataCountries": [
                "US"
            ],
            "status": "compliant"
        },
        "data": {
            "PVTReportID": "{pvt_record_id}:",
            "FluidSampleID": "{data_partition_id}:master-data--FluidSample:20207905:",
            "AnalysisDate": "2012-12-29",
            "LabSampleIdentifier": "20207905-20",
            "LaboratoryName": "Lab",
            "DDMSDatasets": [],
            "Datasets": [],
            "Remarks": [
                {
                    "Remark": "Mounted",
                    "RemarkID": "Remark 1",
                    "RemarkSource": "RemarkSource"
                }
            ],
            "Parameters": []
        }
    }
