[
  {
    "id": "namespace:work-product-component--SamplesAnalysis:c69cf08a-ae35-5984-b855-f9b36ce1ea21",
    "kind": "schema_authority:wks:work-product-component--SamplesAnalysis:1.0.0",
    "version": 1562066009929332,
    "acl": {
      "owners": [
        "someone@company.com"
      ],
      "viewers": [
        "someone@company.com"
      ]
    },
    "legal": {
      "legaltags": [
        "Example legaltags"
      ],
      "otherRelevantDataCountries": [
        "US"
      ],
      "status": "compliant"
    },
    "tags": {
      "NameOfKey": "String value"
    },
    "createTime": "2020-12-16T11:46:20.163Z",
    "createUser": "some-user@some-company-cloud.com",
    "modifyTime": "2020-12-16T11:52:24.477Z",
    "modifyUser": "some-user@some-company-cloud.com",
    "meta": [],
    "data": {
      "SampleIDs": [
        "namespace:master-data--Sample:dd76cf6c-226f-5636-ad1b-1ca0f8249cc10",
        "namespace:master-data--Sample:dd76cf6c-226f-5636-ad1b-1ca0f8249cc11"
      ],
      "ReportSampleIdentifiers": [
        "45H",
        "49H"
      ],
      "AnalysisDate": "08-02-2013",
      "DepthShiftsID": "opendes:work-product-component--WellLog:Test:",
      "LaboratoryIDs": [
        "TBD Lab 1",
        "TBD Lab 2"
      ],
      "LaboratoryNames": [
        "Corelab",
        "Weatherford Labs"
      ],
      "Remarks": [
        "Temperature 68F",
        "Second Remark",
        "Third Remark"
      ],
      "DatePublished": "08-02-2016",
      "ParentSamplesAnalysesReports": [
        {
          "ParentSamplesAnalysisReportID": "namespace:work-product-component--SamplesAnalysesReport:dd76cf6c-226f-5636-ad1b-1ca0f8249cc8",
          "ParentSamplesAnalysisPageNumbers": "12,14,15-20"
        }
      ],
      "SamplesAnalysisTypeIDs": [
        "CapillaryPressureGasOil.CentrifugeDrainageGasOil"
      ],
      "SamplesAnalysisCategoryTagIDs": [
        "CapPressure",
        "CapillaryPressure",
        "SCAL"
      ],
      "AvailableSampleAnalysisProperties": [
        "Depth",
        "Permeability",
        "Porosity",
        "InitialSaturation",
        "Remark",
        "WaterSaturation"
      ]
    }
  }
]
