{
        "id": "{data_partition_id}:work-product-component--MultipleContactMiscibilityTest:{record_id}",
        "kind": "{custom_schema_authority}:wks:work-product-component--MultipleContactMiscibilityTest:{schema_version}",
        "acl": {
            "viewers": ["{acl_viewers}"],
            "owners": ["{acl_owners}"]
        },
        "legal": {
            "legaltags": ["{legal_tag}"],
            "otherRelevantDataCountries": [
                "US"
            ],
            "status": "compliant"
        },
        "data": {
            "PVTReportID": "{pvt_record_id}:",
            "AnalysisDate": "2012-12-29",
            "DDMSDatasets": [],
            "Datasets": [],
            "FluidSampleID": "{data_partition_id}:master-data--FluidSample:20207905:",
            "LabSampleIdentifier": "20207905-20",
            "LaboratoryName": "Lab",
            "Parameters": []
        },
        "ancestry": {
            "parents": []
        }
    }
