{
      "id": "{data_partition_id}:work-product-component--DifferentialLiberationTest:{record_id}",
      "kind": "{custom_schema_authority}:wks:work-product-component--DifferentialLiberationTest:{schema_version}",
      "acl": {
          "viewers": [
              "{acl_viewers}"
          ],
          "owners": [
              "{acl_owners}"
          ]
      },
      "legal": {
          "legaltags": [
              "{legal_tag}"
          ],
          "otherRelevantDataCountries": [
              "US"
          ],
          "status": "compliant"
      },
      "data": {
          "PVTReportID": "{pvt_record_id}:",
          "FluidSampleID": "{data_partition_id}:master-data--FluidSample:fluid_sample_test:",
          "AnalysisDate": "2012-12-15",
          "LabSampleIdentifier": "20207905-20",
          "LaboratoryName": "Lab",
          "DDMSDatasets": []
      }
}
