{
        "id": "{data_partition_id}:work-product-component--SamplesAnalysesReport:{record_id}",
        "kind": "{custom_schema_authority}:wks:work-product-component--SamplesAnalysesReport:{schema_version}",
        "acl": {
            "viewers": ["{acl_viewers}"],
            "owners": ["{acl_owners}"]
        },
        "legal": {
            "legaltags": ["{legal_tag}"],
            "otherRelevantDataCountries": [
                "US"
            ],
            "status": "compliant"
        },
        "tags": {
            "NameOfKey": "String value"
        },
        "meta": [],
        "data": {
            "DocumentTypeID": "{data_partition_id}:reference-data--DocumentType:SampleAnalysisReport:",
            "NumberOfPages": 45,
            "SubTitle": "Advanced Core Analysis Study",
            "DocumentSubject": "SCAL Results Report (Final)",
            "DatePublished": "2020-12-16T11:46:20.163Z",
            "DateModified": "2020-12-16T11:46:20.163Z",
            "DocumentLanguage": "English",
            "SampleIDs": [
                "{data_partition_id}:master-data--Sample:dd76cf6c-226f-5636-ad1b-1ca0f8249cc10:"
            ],
            "ReportSampleIdentifiers": [
                "45H"
            ],
            "SampleAnalysisTypeIDs": [
                "CapillaryPressureGasOil"
            ],
            "SamplesAnalysisCategoryTagIDs": [
                "SCAL"
            ],
            "Remarks": [
                {
                    "Remark": "Test was successfully conducted",
                    "RemarkID": "1",
                    "RemarkSource": "Lab"
                }
            ],
            "LaboratoryIDs": [
                "Lab1"
            ],
            "LaboratoryNames": [
                "Lab1"
            ]
        }
    }
