{
    "id": "{data_partition_id}:work-product-component--SamplesAnalysis:{record_id}",
    "kind": "{schema_authority}:wks:work-product-component--SamplesAnalysis:{schema_version}",
    "acl": {
        "viewers": [
            "{acl_viewers}"
        ],
        "owners": [
            "{acl_owners}"
        ]
    },
    "legal": {
        "legaltags": [
            "{legal_tag}"
        ],
        "otherRelevantDataCountries": [
            "US"
        ],
        "status": "compliant"
    },
    "tags": {
        "NameOfKey": "String value"
    },
    "data": {
        "SampleIDs": [
            "{data_partition_id}:master-data--Sample:Rafsddms_Integration_Test:"
        ],
        "ReportSampleIdentifiers": [
            "88Y"
        ],
        "AnalysisDate": "2022-12-16",
        "LaboratoryIDs": [
            "{data_partition_id}:master-data--Organisation:TBD_Lab_1:"
        ],
        "LaboratoryNames": [
            "TestLab"
        ],
        "LaboratoryAnalysts": [
            "Analyst Contact 1"
        ],
        "Remarks": [
            {
                "Remark": "Test was successfully conducted",
                "RemarkSequenceNumber": 1,
                "RemarkSource": "Lab",
                "RemarkDate": "2023-10-23"
            }
        ],
        "DateAnalyzed": "2022-12-01",
        "DatePublished": "2022-12-16",
        "ParentSamplesAnalysesReports": [
            {
                "ParentSamplesAnalysesReportID": "{sar_v2_record_id}:"
            }
        ],
        "SampleAnalysisTypeIDs": [
            "{data_partition_id}:reference-data--SampleAnalysisType:Extraction:"
        ],
        "SamplesAnalysisCategoryTagIDs": [
            "{data_partition_id}:reference-data--SamplesAnalysisCategoryTag:GreenCompany.SCAL:"
        ],
        "DDMSDatasets": [],
        "Parameters": []
    }
}
